{
  "$schema": "http://json-schema.org/draft-07/schema#",
  "$id": "https://sapiom.ai/schemas/examples-template.json",
  "title": "Sapiom template manifest",
  "description": "Rich per-template detail, co-located beside each example as `template.json`. The registry (`registry.json`) stays the thin gallery list (id/name/description/tags/sourcePath/capabilities/steps); this manifest is the detail layer the Sapiom backend merges into the template + fork detail view. Everything is optional except `manifestVersion` — a bare `{ \"manifestVersion\": 1 }` is valid.",
  "type": "object",
  "required": ["manifestVersion"],
  "additionalProperties": false,
  "properties": {
    "$schema": {
      "type": "string",
      "description": "Optional editor hint pointing at this schema for autocomplete + validation."
    },
    "manifestVersion": {
      "const": 1,
      "description": "Manifest schema version. Only `1` is defined today."
    },
    "author": {
      "type": "object",
      "description": "Who authored the template.",
      "required": ["name"],
      "additionalProperties": false,
      "properties": {
        "name": { "type": "string", "minLength": 1, "description": "Author display name." },
        "url": { "type": "string", "description": "Optional link to the author (site, profile, or repo)." }
      }
    },
    "whatItDoes": {
      "type": "string",
      "maxLength": 320,
      "description": "The card's lead paragraph — about three sentences. LEAD WITH THE VERB (\"Create a cited account brief…\"), never with the audience (\"For turning a…\"). Lived in registry.json until SAP-2076: it is detail-only data (`toSummary` omits it, only `toDetail` reads it) and was 25% of the thin index the shelf fetches, for prose the shelf never renders. It now sits with the other three sections of the same card."
    },
    "longDescription": {
      "type": "string",
      "description": "Markdown prose describing what the template is and how it behaves. Shown on the detail view under \"About\"."
    },
    "useCases": {
      "type": "array",
      "items": { "type": "string", "maxLength": 40 },
      "description": "Concrete things you'd use this template for, as short noun phrases (\"Relationship graph\") — they render as chips, not sentences. Three is the house count."
    },
    "notes": {
      "type": "string",
      "description": "Markdown notes — how to use it, what else it ships with, gotchas."
    },
    "examples": {
      "type": "array",
      "description": "Sample runs: an input, and optionally the output it produces.",
      "items": {
        "type": "object",
        "required": ["input"],
        "additionalProperties": false,
        "properties": {
          "title": { "type": "string", "description": "Optional label for this example." },
          "input": { "type": "object", "description": "The run input payload." },
          "output": { "type": "object", "description": "Optional output the run returns." }
        }
      }
    },
    "requiredSecrets": {
      "type": "array",
      "description": "Third-party credentials the template needs. ONLY for credentials Sapiom cannot broker — never a Sapiom API key, never a non-secret value (use `settings`). Declares what the credential IS, never where it is stored: there is no `vaultRef`, no `connectorId`, no `store`, and there never will be. Binding `key` to a concrete value belongs to the resolver (`process.env[key]` today), which is what lets resolution move to connectors later without touching a manifest or the deploy panel.",
      "items": {
        "type": "object",
        "required": ["key", "label", "provider"],
        "additionalProperties": false,
        "properties": {
          "key": {
            "type": "string",
            "pattern": "^[A-Za-z_][A-Za-z0-9_]{0,255}$",
            "description": "Logical identifier the run reads. Must satisfy the engine's process-env rules: cannot be PATH, SAPIOM_*, or WORKFLOWS_* — namespace rules this pattern cannot express, enforced by the `manifest-secret-key` check in examples-check."
          },
          "label": { "type": "string", "minLength": 1, "description": "Human label for the input field." },
          "provider": { "type": "string", "description": "Provider hint (e.g. \"slack\", \"notion\"). NOT a storage location." },
          "credentialKind": {
            "enum": ["bearer_token", "api_key", "basic", "dsn"],
            "description": "Shape of the credential, so the panel can label and validate the field."
          },
          "description": { "type": "string", "description": "Helper text: what it is, where to get it." },
          "docsUrl": { "type": "string", "description": "Link to the third party's token-creation page." },
          "optional": {
            "type": "boolean",
            "default": false,
            "description": "True when the template degrades honestly without it — the run still reaches a terminal state and names what it skipped in `unmet[]`. False means the run cannot do its job at all."
          }
        }
      }
    },
    "settings": {
      "type": "array",
      "description": "Non-secret configuration with a declared default, rendered as ordinary form fields and merged into the run input. Where a RECIPIENT or a lookback window belongs — NOT the vault, which cannot be listed, validated, or prompted for.",
      "items": {
        "type": "object",
        "required": ["path", "label", "type", "default"],
        "additionalProperties": false,
        "properties": {
          "path": {
            "type": "string",
            "pattern": "^[A-Za-z_$][A-Za-z0-9_$]*(\\.[A-Za-z_$][A-Za-z0-9_$]*)*$",
            "description": "Dotted path into the entry-step input object this setting fills (e.g. `deliverTo`, `client.email`)."
          },
          "label": { "type": "string", "minLength": 1, "description": "Human label for the form field." },
          "description": { "type": "string", "description": "Helper text shown under the field." },
          "type": { "enum": ["string", "number", "boolean", "email", "cron", "string[]", "email[]"] },
          "default": { "description": "The value used when the user supplies nothing. REQUIRED — a setting without a default cannot support a zero-interaction run, which is the entire point." },
          "example": { "description": "A realistic value shown as placeholder text." }
        }
      }
    },
    "resources": {
      "type": "array",
      "description": "Sapiom-managed resources the template provisions. Declarative so deploy can pre-provision and seed, and the UI can state cost and lifetime BEFORE a run — today every template does this imperatively inside a step, which leaves the setup panel nothing to render. Resources key on the PAYMENT ACCOUNT, not the definition, so without this declaration a resource cannot be attributed to a workflow at all; the best a panel could honestly say is \"resources in your account this workflow can use\".",
      "items": {
        "type": "object",
        "required": ["kind", "handle"],
        "additionalProperties": false,
        "properties": {
          "kind": {
            "enum": ["postgres", "sandbox", "repository", "inbox"],
            "description": "What gets provisioned. `setup.provisions[]` in the registry is derived from these."
          },
          "handle": {
            "type": "string",
            "pattern": "^[a-z0-9][a-z0-9-]{0,62}$",
            "description": "Stable lookup handle the step code addresses it by (`ctx.sapiom.database.get(handle)`). Unique within a template — two resources sharing one handle collide at lookup."
          },
          "duration": {
            "enum": ["15m", "1h", "4h", "24h", "7d"],
            "description": "postgres only, and legacy: the platform no longer reads it. A Sapiom Postgres is permanent and metered by slot — see the served rule at https://api.sapiom.ai/v1/agents/authoring-rules#database-lifecycle. Omit it in a new template; existing declarations still parse."
          },
          "seed": {
            "type": "string",
            "description": "Path, relative to the example dir, of a .sql file run once after provisioning so the first run has data to work with. READ-SIDE ONLY: seed a table the template READS. Never seed a table that is the template's own OUTPUT — fabricating rows a user might act on is worse than an empty first run. The file must exist; the `manifest-resource-seed` check enforces that."
          },
          "ephemeral": {
            "type": "boolean",
            "default": true,
            "description": "True when the resource is disposable per run. False signals the template keeps state across runs and needs a durability story in `notes`."
          },
          "reuse": {
            "type": "object",
            "required": ["key"],
            "additionalProperties": false,
            "properties": {
              "key": {
                "type": "string",
                "pattern": "^[A-Za-z_$][A-Za-z0-9_$]*$",
                "description": "The top-level entry-input key the run reads the chosen handle from — `resolveResourceHandle(input, { key })`, default `dbHandle`. This is the settings path the picker writes; a `settings[]` entry with the same `path` may render it as a plain field too. One key per resource is sufficient for the current gallery (one Postgres per template); the field is what makes a second Postgres forward-compatible without inventing a second naming convention. Not a dotted path — `resolveResourceHandle` reads a top-level key only."
              }
            },
            "description": "Present ⇒ the resource is user-repointable: the deploy-time reuse picker may offer \"use a database you already have\", and the run opens the chosen handle instead of the declared default. Absent ⇒ the resource is internal state (not user data) and no picker is offered — the honest marker for a database whose contents a user should never be handed. Only ever offer the picker for a resource whose STEP CODE reads the injected handle via `resolveResourceHandle`; a `reuse` descriptor on a resource the code hardcodes advertises a control the next run silently ignores, which the `manifest-resource-reuse` check rejects."
          }
        }
      }
    },
    "defaultInput": {
      "type": "object",
      "description": "The input a zero-interaction run starts with. Merged UNDER the user's input and UNDER `settings` defaults, so an explicit value always wins. Distinct from `examples[0].input`, which is documentation and may legitimately contain values that cannot work on a fresh tenant (a repo slug, a live sandbox URL). The runtime guarantee lives in code (`z.string().min(1).default(\"Sapiom\")`); this is its declared, renderable projection — the UI cannot introspect a zod schema across a GitHub fetch — and it NEVER overrides code."
    },
    "zeroSetup": {
      "type": "object",
      "description": "The machine-checkable expectation for an unconfigured run. An expectation asserts that the pattern demonstrably ran and the output is honest about it — not that the result is production-grade.",
      "additionalProperties": false,
      "required": ["terminalState"],
      "properties": {
        "terminalState": {
          "enum": ["completed", "completed_partial", "paused_for_approval"],
          "description": "The terminal state a zero-input, zero-credential run is expected to reach."
        },
        "expect": {
          "type": "array",
          "description": "Assertions over the terminal artifact that prove the pattern ran.",
          "items": {
            "type": "object",
            "required": ["path", "assert"],
            "additionalProperties": false,
            "properties": {
              "path": { "type": "string", "description": "Dotted path into the terminal artifact." },
              "assert": {
                "enum": ["nonEmptyArray", "nonEmptyString", "minLength", "matches", "equals", "absent"],
                "description": "Closed assertion vocabulary — anything outside it is a check failure, not a new operator."
              },
              "value": { "description": "Operand for minLength / matches / equals." }
            }
          }
        },
        "narrative": {
          "type": "string",
          "description": "One honest sentence for what an unconfigured run actually produces. Rendered VERBATIM on the shelf as `setup.degradedWithoutSetup` — must never imply a send that will not happen."
        }
      }
    }
  }
}
