{
  "$schema": "../template.schema.json",
  "manifestVersion": 1,
  "author": {
    "name": "Sapiom",
    "url": "https://sapiom.ai/"
  },
  "whatItDoes": "Watch a fleet of workflows and relaunch whichever member has fallen off its cadence. Reads its own event log to work out what is late, then lets a model choose from a fixed list of safe moves — code does anything irreversible. Observe-only mode reports what it would launch.",
  "longDescription": "The Brain coordinates a fleet of agents, watching for the member that silently misses its run. Each cycle is a four-step loop: scan reads its own Postgres event log into plain facts; assess hands those to a model that may only pick from a fixed list of moves, re-checked in code; actuate launches the right member behind guardrails; report writes a Slack briefing and the run back to the log. Observe-only mode reports what it would launch.",
  "useCases": [
    "Fleet cadence monitoring",
    "Fixed list of safe moves",
    "Observe-only mode first"
  ],
  "notes": "Click **Use this template** — Sapiom builds and deploys it for you, then run it from the workflow page. Your $5 signup credit covers first runs.\n\nOut of the box it orchestrates a two-member demo fleet that both launch `hello-agent`, so it runs end to end with nothing else deployed. To point it at your own fleet, deploy those child workflows first and pass your `fleet` in the run input — a child can't be launched until it has been deployed. For the Slack briefing, supply `SLACK_BOT_TOKEN` and pass a `briefingChannelId`; without them it just logs the briefing. Run it with `{ \"observeOnly\": true }` to have it report what it would launch without launching anything.\n\nPrefer to work from the code? Run it locally with `run_local` and `{ \"dryRun\": true }` to trace the whole scan → assess → actuate → report loop for free — the real model call still runs, only the network side effects are skipped — or edit and deploy it with the Sapiom MCP.",
  "resources": [
    {
      "kind": "postgres",
      "handle": "the-brain",
      "ephemeral": false
    }
  ],
  "requiredSecrets": [
    {
      "key": "SLACK_BOT_TOKEN",
      "label": "Slack bot token",
      "provider": "slack",
      "credentialKind": "bearer_token",
      "description": "A Slack bot token (`xoxb-…`) with `chat:write`. Without it the briefing is returned in the run's output and nothing is posted.",
      "docsUrl": "https://api.slack.com/authentication/basics",
      "optional": true
    }
  ],
  "settings": [
    {
      "path": "briefingChannelId",
      "label": "Slack channel or user id",
      "description": "Where the daily briefing is posted. Leave it empty and the briefing stays in the run's output.",
      "type": "string",
      "default": "",
      "example": "C0123456789"
    }
  ],
  "examples": [
    {
      "title": "Trace the full loop offline (run_local)",
      "input": {
        "dryRun": true,
        "now": "2026-07-22T14:00:00.000Z"
      },
      "output": {
        "lookedAt": 2,
        "launched": [
          "launch_member → hello-agent (dryrun-hello-agent-launch_member-daily-greeter-2026-07-22)",
          "launch_member → hello-agent (dryrun-hello-agent-launch_member-weekly-greeter-2026-07-22)"
        ],
        "needsHuman": [],
        "cursor": 0
      }
    },
    {
      "title": "Report what it would launch, without launching (observe-only)",
      "input": {
        "observeOnly": true,
        "briefingChannelId": "C0EXAMPLE",
        "now": "2026-07-22T14:00:00.000Z"
      },
      "output": {
        "lookedAt": 2,
        "launched": [
          "would launch: hello-agent for daily-greeter",
          "would launch: hello-agent for weekly-greeter"
        ],
        "needsHuman": []
      }
    }
  ]
}
