{
  "$schema": "../template.schema.json",
  "manifestVersion": 1,
  "author": {
    "name": "Sapiom",
    "url": "https://sapiom.ai/"
  },
  "whatItDoes": "Review each pull request as it opens and flag behavior changes that ship without tests. Registers a PR webhook and then waits, costing nothing while idle — it can sit for days between reviews — and posts the result to email or Slack.",
  "longDescription": "A review bot that wakes when someone opens a pull request. It waits on a webhook, idle for days between reviews and spending nothing until one arrives. When it does, a coding agent checks the code out in a sandbox and reads the diff, looking hardest at test coverage and reviewing without editing so nothing is pushed. A model turns the raw notes into a short structured review and delivers it to your email or a Slack channel using your own bot token.",
  "useCases": [
    "Missing-test detection",
    "Posts to email or Slack",
    "$0 while idle"
  ],
  "notes": "**Use this template.** Click **Use this template** — Sapiom builds and deploys it for you; open it on the **Agents** page and run it. Your $5 signup credit covers first runs.\n\nThis agent run **pauses and waits for a PR**. A real run suspends at `watch` at $0 until a pull request is opened. In dev there's no one-click signal button yet — fire the `pr.opened` signal yourself with the MCP `workflow_signal` tool (or the API), passing the paused run's `executionId` as the `correlationId` and the PR as the `payload`. See the README for the exact shape.\n\nTo deliver to Slack instead of email, set `\"via\": \"slack\"` with `\"to\": \"#your-channel\"`, and supply `SLACK_BOT_TOKEN` — Sapiom asks for it when you use the template. Without it the run still completes — it just skips the post.\n\n**Prefer to work from the code?** Run it locally with `run_local` to trace the whole flow for free (it uses a built-in sample PR), or edit and deploy it with the Sapiom MCP.",
  "requiredSecrets": [
    {
      "key": "SLACK_BOT_TOKEN",
      "label": "Slack bot token",
      "provider": "slack",
      "credentialKind": "bearer_token",
      "description": "A Slack bot token (`xoxb-…`) with `chat:write`, only for `via: \"slack\"`. Without it the review is returned in the run's output and nothing is posted.",
      "docsUrl": "https://api.slack.com/authentication/basics",
      "optional": true
    }
  ],
  "settings": [
    {
      "path": "to",
      "label": "Send the review to",
      "description": "Where the review is emailed. Leave it empty and the review is returned in the run's output instead.",
      "type": "email",
      "default": "",
      "example": "you@yourcompany.com"
    }
  ],
  "examples": [
    {
      "title": "No webhook source — review the sample PR, email skipped",
      "input": {},
      "output": {
        "posted": false,
        "skipped": "no-recipient",
        "via": "email",
        "verdict": "request_changes",
        "unmet": ["to"],
        "note": "No `WEBHOOK_REGISTER_URL` is configured, so no PR event was awaited — this is a review of the built-in sample PR. Point the template at a webhook source to review real ones. Nothing was delivered: no `to` address is set, so the review is in this run's output only."
      }
    },
    {
      "title": "A PR opens (the resume signal payload)",
      "input": {
        "repo": {
          "owner": "acme",
          "name": "api"
        },
        "number": 42,
        "title": "Add avatar upload endpoint",
        "branch": "feat/avatar-upload",
        "baseBranch": "main",
        "diff": "diff --git a/src/users/avatar.ts b/src/users/avatar.ts\n+export async function uploadAvatar(userId, file) { ... }"
      },
      "output": {
        "posted": true,
        "skipped": null,
        "via": "email",
        "verdict": "request_changes"
      }
    }
  ],
  "zeroSetup": {
    "terminalState": "completed",
    "expect": [
      { "path": "verdict", "assert": "nonEmptyString" },
      { "path": "posted", "assert": "equals", "value": false }
    ],
    "narrative": "Runs a coding agent to review the sample PR and returns a verdict; posts nothing (no webhook)."
  }
}
