{
  "$schema": "../template.schema.json",
  "manifestVersion": 1,
  "author": {
    "name": "Sapiom",
    "url": "https://sapiom.ai/"
  },
  "whatItDoes": "Turn what was said on a call into an updated CRM record without hand-copying anything. Pull the contact, the fields to change, and the action items out of a transcript, write them to a database deduped against prior meetings, and email a summary.",
  "longDescription": "Hand it a meeting transcript and it does the CRM busywork: who the call was with, what to change, and the action items. Set `webhook: true` to wait for your note-taker to push one in. `extract` (`llm.run`) returns structured data; `upsert` writes to a small Postgres CRM store keyed by email, without wiping fields the call did not mention and recording each item under a stable id so a re-run never double-writes. `summary` emails a recap, and `dryRun` skips the database and mail.",
  "useCases": [
    "Transcript to CRM record",
    "Action items extracted",
    "Deduped across meetings"
  ],
  "notes": "Click **Use this template** — Sapiom builds and deploys it for you; open it on the **Agents** page and run it. Your $5 signup credit covers first runs.\n\nFeed it the notes as `transcript` (plain text). It runs with no setup: given no transcript it extracts from a built-in sample call and says so in its output. Set `deliverTo` to have the recap emailed; without it the recap is returned in the run's output. Pass `meetingDate` (ISO) to stamp the contact's last-meeting time, and `dryRun: true` to compute the recap and get it back without writing to the database or sending mail.\n\nThis template can also **pause and wait for a webhook**: run it with `webhook: true` and no transcript, and it suspends at $0 until your note-taker pushes one. Send the transcript with the MCP `workflow_signal` tool (or the API) using the signal name `transcript.ready` and a payload of `{ \"transcript\": \"...\" }` — there is no one-click signal button yet.\n\nPrefer to work from the code? Run it locally with `run_local` to trace the whole intake → extract → upsert → summary flow for free (capabilities stubbed, database and delivery skipped), or edit and deploy it with the Sapiom MCP.",
  "resources": [
    {
      "kind": "postgres",
      "handle": "meeting-notes-crm",
      "ephemeral": false,
      "reuse": { "key": "dbHandle" }
    }
  ],
  "settings": [
    {
      "path": "dbHandle",
      "label": "CRM database handle",
      "description": "The Sapiom Postgres this agent reads and writes. Leave the default to use the database Sapiom provisions for this template, or point it at a handle you already own.",
      "type": "string",
      "default": "meeting-notes-crm",
      "example": "meeting-notes-crm"
    },
    {
      "path": "deliverTo",
      "label": "Email the recap to",
      "description": "Where the recap is emailed. Leave it empty and the recap is returned in the run's output instead.",
      "type": "email",
      "default": "",
      "example": "you@yourcompany.com"
    }
  ],
  "examples": [
    {
      "title": "Extract a short call, preview only (dry run)",
      "input": {
        "dryRun": true,
        "transcript": "Call with Dana Ruiz, VP Eng at Northwind. She confirmed budget for the Q3 rollout and wants a security review before signing. I'll send the SOC 2 report by Friday and Dana will loop in their CISO next week. Deal looks like it's moving to contract stage.",
        "meetingDate": "2026-07-22"
      },
      "output": {
        "delivered": false,
        "dryRun": true,
        "reason": "dry-run",
        "to": null,
        "subject": "CRM updated: Northwind — 2 new action item(s)",
        "contact": {
          "name": "Dana Ruiz",
          "email": null,
          "company": "Northwind",
          "title": "VP Eng"
        },
        "newCount": 2,
        "existingCount": 0,
        "summary": "# Meeting notes → CRM\n\n**Contact:** Dana Ruiz — VP Eng, Northwind\n**Deal stage:** contract\n**Next step:** Send SOC 2 report, then security review before signing\n\nDana confirmed Q3 rollout budget and wants a security review before signing.\n\n## Action items (2 new, 0 already tracked)\n### New (2)\n- Send the SOC 2 report _(me, due Friday)_\n- Loop in the CISO _(Dana, due next week)_\n\n### Already tracked (0)\n_None._"
      }
    }
  ],
  "zeroSetup": {
    "terminalState": "completed_partial",
    "expect": [
      { "path": "summary", "assert": "nonEmptyString" },
      { "path": "delivered", "assert": "equals", "value": false },
      { "path": "unmet", "assert": "nonEmptyArray" }
    ],
    "narrative": "Turns sample meeting notes into a CRM update summary; emails nothing (no recipient)."
  }
}
