{
  "$schema": "../template.schema.json",
  "manifestVersion": 1,
  "author": {
    "name": "Sapiom",
    "url": "https://sapiom.ai/"
  },
  "whatItDoes": "Start a slow external job, pause at $0 until it calls back, then summarize the result and decide whether to accept it. For a render, a batch export, or any third-party job whose answer arrives hours later by callback.",
  "longDescription": "Some work hinges on a slow external job, a render, a batch export, a screening service, that finishes on its own schedule and calls back when done. It starts that job and waits for the callback instead of holding a worker open or polling. `kickoff` tells the job how to reach this run, then pauses (`pauseUntilSignal`) for minutes, hours, or days. When the webhook fires, its payload becomes `decide`'s input, a model summarizes it, and the run branches to accept or reject.",
  "useCases": [
    "Pause for a slow callback",
    "$0 while waiting",
    "Branch on the outcome"
  ],
  "notes": "Click **Use this template** — Sapiom builds and deploys it for you, then run it from the workflow page. Your $5 signup credit covers first runs.\n\nA deployed run pauses at `kickoff` and waits for the callback. Instead of a real webhook, send the signal yourself with the MCP `sapiom_dev_agents_signal` tool: `{ \"executionId\": \"<executionId of the paused run>\", \"name\": \"webhook.callback\", \"correlationId\": \"<executionId of the paused run>\", \"payload\": { \"status\": \"succeeded\", \"result\": { ... } } }`. The `payload` becomes `decide`'s input, and a `status` of `failed` or `error` makes it reject. With no `CALLBACK_REGISTER_URL` set (or `DRY_RUN`), it runs offline and skips the live job.\n\nThe pause costs $0 for as long as it lasts, and with no `timeoutMs` it inherits the engine's 7-day default deadline. To size the wait to your own callback window, set `config.CALLBACK_TIMEOUT_MS` to a positive number of milliseconds — if no callback lands in that window, the run ends with an honest pause-timeout failure instead.\n\nPrefer to work from the code? Run it locally with `run_local` to trace the whole flow — kickoff, pause, decide, branch — for free, or edit and deploy it with the Sapiom MCP.",
  "examples": [
    {
      "title": "Callback reports success",
      "input": {
        "job": {
          "kind": "render",
          "assetId": "abc123"
        },
        "config": {}
      },
      "output": {
        "jobId": "dry-run",
        "decision": "accept",
        "summary": "The external job completed and returned a usable result."
      }
    },
    {
      "title": "Callback reports failure",
      "input": {
        "job": {
          "kind": "render",
          "assetId": "abc123"
        }
      },
      "output": {
        "jobId": "dry-run",
        "decision": "reject",
        "summary": "The external job reported a failure status.",
        "reasons": ["status=\"failed\""]
      }
    }
  ],
  "zeroSetup": {
    "terminalState": "completed_partial",
    "expect": [
      { "path": "decision", "assert": "nonEmptyString" },
      { "path": "unmet", "assert": "nonEmptyArray" }
    ],
    "narrative": "Evaluates the sample job and returns a decision; registers no external callback."
  }
}
